{
  "$schema": "./schema.json",
  "catalogVersion": 1,
  "updatedAt": "2026-10-19",
  "artist": "Ünal Büyüksungur",
  "source": {
    "coversDir": "UNAL_MUSIC_ARCHIVE/covers",
    "lyricsDir": "UNAL_MUSIC_ARCHIVE/lyrics",
    "storiesDir": "UNAL_MUSIC_ARCHIVE/stories"
  },
  "works": [
    {
      "id": "w-0001",
      "title": "Ağlama",
      "titleStatus": "confirmed",
      "workingTitle": null,
      "slug": "aglama",
      "language": "tr",
      "releaseStatus": "unknown",
      "lyrics": {
        "status": "published",
        "file": "content/lyrics/w-0001.txt"
      },
      "story": {
        "status": "published",
        "file": "content/stories/w-0001.txt"
      }
    },
    {
      "id": "w-0002",
      "title": "Akrep",
      "titleStatus": "confirmed",
      "workingTitle": null,
      "slug": "akrep",
      "language": "tr",
      "releaseStatus": "unknown",
      "lyrics": {
        "status": "published",
        "file": "content/lyrics/w-0002.txt"
      },
      "story": {
        "status": "published",
        "file": "content/stories/w-0002.txt"
      }
    },
    {
      "id": "w-0003",
      "title": "Angaralı Hasret",
      "titleStatus": "confirmed",
      "workingTitle": null,
      "slug": "angarali-hasret",
      "language": "tr",
      "releaseStatus": "unknown",
      "lyrics": {
        "status": "published",
        "file": "content/lyrics/w-0003.txt"
      },
      "story": {
        "status": "published",
        "file": "content/stories/w-0003.txt"
      }
    },
    {
      "id": "w-0004",
      "title": "Anneler Günü",
      "titleStatus": "confirmed",
      "workingTitle": null,
      "slug": "anneler-gunu",
      "language": "tr",
      "releaseStatus": "unknown",
      "lyrics": {
        "status": "published",
        "file": "content/lyrics/w-0004.txt"
      },
      "story": {
        "status": "published",
        "file": "content/stories/w-0004.txt"
      }
    },
    {
      "id": "w-0005",
      "title": "Aslan",
      "titleStatus": "confirmed",
      "workingTitle": null,
      "slug": "aslan",
      "language": "tr",
      "releaseStatus": "unknown",
      "lyrics": {
        "status": "published",
        "file": "content/lyrics/w-0005.txt"
      },
      "story": {
        "status": "published",
        "file": "content/stories/w-0005.txt"
      }
    },
    {
      "id": "w-0006",
      "title": "Aşkım",
      "titleStatus": "confirmed",
      "workingTitle": null,
      "slug": "askim",
      "language": "tr",
      "releaseStatus": "unknown",
      "lyrics": {
        "status": "published",
        "file": "content/lyrics/w-0006.txt"
      },
      "story": {
        "status": "published",
        "file": "content/stories/w-0006.txt"
      }
    },
    {
      "id": "w-0007",
      "title": "Babalar Günü",
      "titleStatus": "confirmed",
      "workingTitle": null,
      "slug": "babalar-gunu",
      "language": "tr",
      "releaseStatus": "unknown",
      "lyrics": {
        "status": "published",
        "file": "content/lyrics/w-0007.txt"
      },
      "story": {
        "status": "published",
        "file": "content/stories/w-0007.txt"
      }
    },
    {
      "id": "w-0008",
      "title": "Balık",
      "titleStatus": "confirmed",
      "workingTitle": null,
      "slug": "balik",
      "language": "tr",
      "releaseStatus": "unknown",
      "lyrics": {
        "status": "published",
        "file": "content/lyrics/w-0008.txt"
      },
      "story": {
        "status": "published",
        "file": "content/stories/w-0008.txt"
      }
    },
    {
      "id": "w-0009",
      "title": "Başak",
      "titleStatus": "confirmed",
      "workingTitle": null,
      "slug": "basak",
      "language": "tr",
      "releaseStatus": "unknown",
      "lyrics": {
        "status": "published",
        "file": "content/lyrics/w-0009.txt"
      },
      "story": {
        "status": "published",
        "file": "content/stories/w-0009.txt"
      }
    },
    {
      "id": "w-0010",
      "title": "Ben Boğa'yım",
      "titleStatus": "confirmed",
      "workingTitle": null,
      "slug": "ben-bogayim",
      "language": "tr",
      "releaseStatus": "unknown",
      "lyrics": {
        "status": "published",
        "file": "content/lyrics/w-0010.txt"
      },
      "story": {
        "status": "published",
        "file": "content/stories/w-0010.txt"
      }
    },
    {
      "id": "w-0011",
      "title": "Beni Sal",
      "titleStatus": "confirmed",
      "workingTitle": null,
      "slug": "beni-sal",
      "language": "tr",
      "releaseStatus": "unknown",
      "lyrics": {
        "status": "published",
        "file": "content/lyrics/w-0011.txt"
      },
      "story": {
        "status": "published",
        "file": "content/stories/w-0011.txt"
      }
    },
    {
      "id": "w-0012",
      "title": "Beni Yâr Seçtin",
      "titleStatus": "confirmed",
      "workingTitle": null,
      "slug": "beni-yar-sectin",
      "language": "tr",
      "releaseStatus": "unknown",
      "lyrics": {
        "status": "published",
        "file": "content/lyrics/w-0012.txt"
      },
      "story": {
        "status": "published",
        "file": "content/stories/w-0012.txt"
      }
    },
    {
      "id": "w-0013",
      "title": "Benimle Yaşlanacaktın",
      "titleStatus": "confirmed",
      "workingTitle": null,
      "slug": "benimle-yaslanacaktin",
      "language": "tr",
      "releaseStatus": "unknown",
      "lyrics": {
        "status": "published",
        "file": "content/lyrics/w-0013.txt"
      },
      "story": {
        "status": "published",
        "file": "content/stories/w-0013.txt"
      }
    },
    {
      "id": "w-0014",
      "title": "Biliyorum",
      "titleStatus": "confirmed",
      "workingTitle": null,
      "slug": "biliyorum",
      "language": "tr",
      "releaseStatus": "unknown",
      "lyrics": {
        "status": "published",
        "file": "content/lyrics/w-0014.txt"
      },
      "story": {
        "status": "published",
        "file": "content/stories/w-0014.txt"
      }
    },
    {
      "id": "w-0015",
      "title": "Bir Güzel Sevdim",
      "titleStatus": "confirmed",
      "workingTitle": null,
      "slug": "bir-guzel-sevdim",
      "language": "tr",
      "releaseStatus": "unknown",
      "lyrics": {
        "status": "published",
        "file": "content/lyrics/w-0015.txt"
      },
      "story": {
        "status": "published",
        "file": "content/stories/w-0015.txt"
      }
    },
    {
      "id": "w-0016",
      "title": "Bir Kedim Var",
      "titleStatus": "confirmed",
      "workingTitle": null,
      "slug": "bir-kedim-var",
      "language": "tr",
      "releaseStatus": "unknown",
      "lyrics": {
        "status": "published",
        "file": "content/lyrics/w-0016.txt"
      },
      "story": {
        "status": "published",
        "file": "content/stories/w-0016.txt"
      }
    },
    {
      "id": "w-0017",
      "title": "Biten Sadece Zaman",
      "titleStatus": "confirmed",
      "workingTitle": null,
      "slug": "biten-sadece-zaman",
      "language": "tr",
      "releaseStatus": "unknown",
      "lyrics": {
        "status": "published",
        "file": "content/lyrics/w-0017.txt"
      },
      "story": {
        "status": "published",
        "file": "content/stories/w-0017.txt"
      }
    },
    {
      "id": "w-0018",
      "title": "Boğa",
      "titleStatus": "confirmed",
      "workingTitle": null,
      "slug": "boga",
      "language": "tr",
      "releaseStatus": "unknown",
      "lyrics": {
        "status": "published",
        "file": "content/lyrics/w-0018.txt"
      },
      "story": {
        "status": "published",
        "file": "content/stories/w-0018.txt"
      }
    },
    {
      "id": "w-0019",
      "title": "Boşver Geç",
      "titleStatus": "confirmed",
      "workingTitle": null,
      "slug": "bosver-gec",
      "language": "tr",
      "releaseStatus": "unknown",
      "lyrics": {
        "status": "published",
        "file": "content/lyrics/w-0019.txt"
      },
      "story": {
        "status": "published",
        "file": "content/stories/w-0019.txt"
      }
    },
    {
      "id": "w-0020",
      "title": "Öyle Bir Şey",
      "titleStatus": "confirmed",
      "workingTitle": null,
      "slug": "oyle-bir-sey",
      "language": "tr",
      "releaseStatus": "unknown",
      "lyrics": {
        "status": "published",
        "file": "content/lyrics/w-0020.txt"
      },
      "story": {
        "status": "published",
        "file": "content/stories/w-0020.txt"
      }
    },
    {
      "id": "w-0021",
      "title": "Bugün Benim Doğum Günüm",
      "titleStatus": "confirmed",
      "workingTitle": null,
      "slug": "bugun-benim-dogum-gunum",
      "language": "tr",
      "releaseStatus": "unknown",
      "lyrics": {
        "status": "published",
        "file": "content/lyrics/w-0021.txt"
      },
      "story": {
        "status": "published",
        "file": "content/stories/w-0021.txt"
      }
    },
    {
      "id": "w-0022",
      "title": "Çarpıldım Sana",
      "titleStatus": "confirmed",
      "workingTitle": null,
      "slug": "carpildim-sana",
      "language": "tr",
      "releaseStatus": "unknown",
      "lyrics": {
        "status": "published",
        "file": "content/lyrics/w-0022.txt"
      },
      "story": {
        "status": "published",
        "file": "content/stories/w-0022.txt"
      }
    },
    {
      "id": "w-0023",
      "title": "Çat Çat Çat",
      "titleStatus": "confirmed",
      "workingTitle": null,